{"design":{"contrastiveGradientDefinition":"grad(F_scarcity) - grad(F_stable) at the same RUL-021 pre-shock centroid","finiteDifferenceStepUnit":0.06,"performanceTarget":"time-averaged population persistence divided by initial population over matched 120-step homogeneous no-mutation probes","primaryCriteria":{"contrastiveGradientIdentifiable":">= 3/4 of seeds have nonzero contrastive finite-difference gradient norm","scarcityContrastiveAlignmentExceedsNeutral":">= +0.10 median paired cosine advantage over neutral bottleneck motion","scarcityMedianContrastiveAlignmentPositive":">= 0.10 median cosine with the contrastive scarcity-minus-stable gradient","scarcityPositiveInMajority":">= 2/3 of seeds have positive scarcity/contrastive-gradient cosine"},"ruleDimensions":["forage_weight","hazard_avoidance","exploration","reproduction_threshold"],"seedCount":12,"seeds":[14003,14011,14029,14041,14057,14071,14087,14101,14119,14137,14153,14173],"stableProbesPerSeed":8},"experimentId":"RUL-023","interpretationBoundary":["RUL-023 is an engineered ALife contrastive-selection diagnostic, not evidence about natural biological evolution.","The contrastive gradient subtracts a stable-resource local performance landscape from the scarcity landscape at the same frozen pre-shock rule centroid.","The scarcity component is reused exactly from committed RUL-022 probes; only the matched stable-resource probes are new in RUL-023.","The performance target remains short-horizon population persistence in homogeneous no-mutation probe populations and is not a universal fitness function.","Positive selection-specific contrastive alignment would strengthen the interpretation that environmental scarcity shapes the direction of rulial motion; failure would challenge that interpretation without erasing the observed motion itself."],"observerId":"OBSERVER-ALIFE-CONTRASTIVE-GRADIENT","primaryTest":{"contrastiveGradientIdentifiable":true,"criteriaPassed":1,"criteriaTotal":4,"pilotSupported":false,"scarcityContrastiveAlignmentExceedsNeutral":false,"scarcityMedianContrastiveAlignmentPositive":false,"scarcityPositiveInMajority":false},"results":{"identifiableContrastiveGradientCount":12,"meanNeutralContrastiveAlignment":0.11417119878730202,"meanScarcityContrastiveAlignment":-0.12190251035964084,"medianContrastiveGradientNorm":0.7846705063832204,"medianNeutralContrastiveAlignment":0.0565504807370162,"medianScarcityContrastiveAlignment":0.03813700897723067,"medianScarcityMinusNeutralContrastiveAlignment":-0.07880996556568526,"positiveAlignmentAdvantageCount":5,"positiveScarcityAlignmentCount":6},"ruleSpaceId":"RSPACE-ALIFE-001","schemaVersion":"entropy-rulial-alife-contrastive-gradient/1.0.0","source":{"motionExperiment":"RUL-021","motionSourceReport":"data/ruliology/alife-selection-control/alife-selection-control-report.json","newMotionSimulations":0,"newStableProbeSimulations":96,"reusedScarcityProbeSimulations":96,"scarcityGradientExperiment":"RUL-022","scarcityGradientSourceReport":"data/ruliology/alife-fitness-gradient/alife-fitness-gradient-report.json"}}
